{
  "name": "win11_rtx3060_en-us",
  "version": 1,
  "identity": {
    "user_agent": "Mozilla/5.0 (Windows NT 10.0; Win64; x64) AppleWebKit/537.36 (KHTML, like Gecko) Chrome/154.0.0.0 Safari/537.36",
    "client_hints": {
      "brands": [
        { "brand": "Chromium", "version": "154" },
        { "brand": "Google Chrome", "version": "154" },
        { "brand": "Not A(Brand", "version": "99" }
      ],
      "platform": "Windows",
      "platform_version": "15.0.0",
      "architecture": "x86",
      "bitness": "64",
      "model": "",
      "mobile": false,
      "wow64": false
    },
    "navigator_platform": "Win32",
    "navigator_app_version": "5.0 (Windows NT 10.0; Win64; x64) AppleWebKit/537.36 (KHTML, like Gecko) Chrome/154.0.0.0 Safari/537.36",
    "navigator_vendor": "Google Inc.",
    "navigator_product": "Gecko",
    "navigator_product_sub": "20030107"
  },
  "locale": {
    "languages": ["en-US", "en"],
    "accept_language": "en-US,en;q=0.9",
    "timezone": "America/Chicago",
    "currency": "USD"
  },
  "hardware": {
    "hardware_concurrency": 12,
    "device_memory_gb": 8,
    "max_touch_points": 0,
    "battery": {
      "charging": true,
      "level": 1.0,
      "charging_time_seconds": 0,
      "discharging_time_seconds": null
    }
  },
  "gpu": {
    "vendor": "Google Inc. (NVIDIA)",
    "renderer": "ANGLE (NVIDIA, NVIDIA GeForce RTX 3060 Direct3D11 vs_5_0 ps_5_0, D3D11)",
    "vendor_id": "0x10de",
    "device_id": "0x2504",
    "webgl_limits": {
      "MAX_TEXTURE_SIZE": "16384",
      "MAX_CUBE_MAP_TEXTURE_SIZE": "16384",
      "MAX_RENDERBUFFER_SIZE": "16384",
      "MAX_VIEWPORT_DIMS": "16384x16384",
      "MAX_SAMPLES": "8"
    },
    "webgl_excluded_extensions": [
      "WEBGL_compressed_texture_astc",
      "WEBGL_compressed_texture_etc",
      "WEBGL_compressed_texture_etc1"
    ],
    "webgl_version": "WebGL 2.0 (OpenGL ES 3.0 Chromium)",
    "webgpu_adapter": {
      "vendor": "nvidia",
      "architecture": "ampere",
      "device": "rtx-3060"
    }
  },
  "screen": {
    "width": 1920,
    "height": 1080,
    "avail_width": 1920,
    "avail_height": 1032,
    "color_depth": 24,
    "pixel_depth": 24,
    "device_pixel_ratio": 1,
    "avail_left": 0,
    "avail_top": 0
  },
  "audio": {
    "sample_rate": 48000,
    "base_latency": 0.005333333333333333,
    "output_latency": 0.04,
    "max_channel_count": 2
  },
  "media_devices": [
    { "kind": "audioinput",  "label": "Default - Microphone (Realtek(R) Audio)", "deviceId": "default", "groupId": "g1" },
    { "kind": "audioinput",  "label": "Microphone (Realtek(R) Audio)",           "deviceId": "a1",      "groupId": "g1" },
    { "kind": "audiooutput", "label": "Default - Speakers (Realtek(R) Audio)",   "deviceId": "default", "groupId": "g1" },
    { "kind": "audiooutput", "label": "Speakers (Realtek(R) Audio)",             "deviceId": "o1",      "groupId": "g1" },
    { "kind": "videoinput",  "label": "HD Webcam",                                "deviceId": "v1",      "groupId": "g2" }
  ],
  "voices": [
    { "name": "Microsoft David - English (United States)",  "lang": "en-US", "default": true,  "localService": true, "voiceURI": "Microsoft David - English (United States)" },
    { "name": "Microsoft Zira - English (United States)",   "lang": "en-US", "default": false, "localService": true, "voiceURI": "Microsoft Zira - English (United States)" },
    { "name": "Microsoft Mark - English (United States)",   "lang": "en-US", "default": false, "localService": true, "voiceURI": "Microsoft Mark - English (United States)" },
    { "name": "Google US English",                          "lang": "en-US", "default": false, "localService": false, "voiceURI": "Google US English" },
    { "name": "Google UK English Female",                   "lang": "en-GB", "default": false, "localService": false, "voiceURI": "Google UK English Female" },
    { "name": "Google UK English Male",                     "lang": "en-GB", "default": false, "localService": false, "voiceURI": "Google UK English Male" }
  ],
  "fonts": {
    "installed": [
      "Arial", "Arial Black", "Arial Narrow", "Bahnschrift", "Calibri", "Cambria", "Cambria Math",
      "Candara", "Comic Sans MS", "Consolas", "Constantia", "Corbel", "Courier New", "Ebrima",
      "Franklin Gothic Medium", "Gabriola", "Gadugi", "Georgia", "HoloLens MDL2 Assets",
      "Impact", "Ink Free", "Javanese Text", "Leelawadee UI", "Lucida Console", "Lucida Sans Unicode",
      "Malgun Gothic", "Marlett", "Microsoft Himalaya", "Microsoft JhengHei", "Microsoft New Tai Lue",
      "Microsoft PhagsPa", "Microsoft Sans Serif", "Microsoft Tai Le", "Microsoft YaHei",
      "Microsoft Yi Baiti", "MingLiU-ExtB", "Mongolian Baiti", "MS Gothic", "MV Boli", "Myanmar Text",
      "Nirmala UI", "Palatino Linotype", "Segoe MDL2 Assets", "Segoe Print", "Segoe Script",
      "Segoe UI", "Segoe UI Emoji", "Segoe UI Historic", "Segoe UI Symbol", "SimSun", "Sitka",
      "Sylfaen", "Symbol", "Tahoma", "Times New Roman", "Trebuchet MS", "Verdana", "Webdings", "Wingdings",
      "Yu Gothic"
    ]
  },
  "webrtc": {
    "ip_handling_policy": "default_public_interface_only",
    "stun_servers": []
  },
  "canvas_noise": {
    "seed": "a1b2c3d4e5f607182939404152636475"
  },
  "tls": {
    "ciphers": "ALL:!aPSK:!ECDSA+SHA1:!3DES",
    "sigalgs": [
      "ecdsa_secp256r1_sha256",
      "rsa_pss_rsae_sha256",
      "rsa_pkcs1_sha256",
      "ecdsa_secp384r1_sha384",
      "rsa_pss_rsae_sha384",
      "rsa_pkcs1_sha384",
      "rsa_pss_rsae_sha512",
      "rsa_pkcs1_sha512"
    ],
    "curves": ["X25519", "P-256", "P-384"],
    "alpn": ["h2", "http/1.1"],
    "min_version": "tls1.2",
    "max_version": "tls1.3",
    "permute_extensions": true,
    "grease": true
  },
  "browser_state": {
    "history_length": 12,
    "download_count": 6,
    "extensions": [
      { "id": "cjpalhdlnbpafiamejdnhcphjbkeiagm", "name": "uBlock Origin", "version": "1.62.0" },
      { "id": "nngceckbapebfimnlniiiahkandclblb", "name": "Bitwarden Password Manager", "version": "2025.1.0" },
      { "id": "bmnlcjabgnpnenekpadlanbbkooimhnj", "name": "Honey: Automatic Coupons & Rewards", "version": "17.5.0" },
      { "id": "gighmmpiobklfepjocnamgkkbiglidom", "name": "AdBlock — best ad blocker", "version": "6.11.0" },
      { "id": "ghbmnnjooekpmoecnnnilnnbdlolhkhi", "name": "Google Docs Offline", "version": "1.94.0" }
    ]
  },
  "strip_automation_tells": false,
  "chrome_version": "154.0.8037.57"
}
