{
  "name": "macos_m2_en-us",
  "version": 1,
  "identity": {
    "user_agent": "Mozilla/5.0 (Macintosh; Intel Mac OS X 10_15_7) AppleWebKit/537.36 (KHTML, like Gecko) Chrome/154.0.0.0 Safari/537.36",
    "client_hints": {
      "brands": [
        { "brand": "Chromium", "version": "154" },
        { "brand": "Google Chrome", "version": "154" },
        { "brand": "Not A(Brand", "version": "99" }
      ],
      "platform": "macOS",
      "platform_version": "14.4.1",
      "architecture": "arm",
      "bitness": "64",
      "model": "",
      "mobile": false,
      "wow64": false
    },
    "navigator_platform": "MacIntel",
    "navigator_app_version": "5.0 (Macintosh; Intel Mac OS X 10_15_7) AppleWebKit/537.36 (KHTML, like Gecko) Chrome/154.0.0.0 Safari/537.36",
    "navigator_vendor": "Google Inc.",
    "navigator_product": "Gecko",
    "navigator_product_sub": "20030107"
  },
  "locale": {
    "languages": ["en-US", "en"],
    "accept_language": "en-US,en;q=0.9",
    "timezone": "America/Los_Angeles",
    "currency": "USD"
  },
  "hardware": {
    "hardware_concurrency": 8,
    "device_memory_gb": 8,
    "max_touch_points": 0,
    "battery": {
      "charging": false,
      "level": 0.78,
      "charging_time_seconds": null,
      "discharging_time_seconds": 14400
    }
  },
  "gpu": {
    "vendor": "Google Inc. (Apple)",
    "renderer": "ANGLE (Apple, ANGLE Metal Renderer: Apple M2, Unspecified Version)",
    "vendor_id": "0x106b",
    "device_id": "0x0000",
    "webgl_limits": {
      "MAX_TEXTURE_SIZE": "16384",
      "MAX_CUBE_MAP_TEXTURE_SIZE": "16384",
      "MAX_RENDERBUFFER_SIZE": "16384",
      "MAX_VIEWPORT_DIMS": "16384x16384",
      "MAX_SAMPLES": "4"
    },
    "webgl_excluded_extensions": [],
    "webgl_version": "WebGL 2.0 (OpenGL ES 3.0 Chromium)",
    "webgpu_adapter": {
      "vendor": "apple",
      "architecture": "apple-m2",
      "device": ""
    }
  },
  "screen": {
    "width": 1470,
    "height": 956,
    "avail_width": 1470,
    "avail_height": 919,
    "color_depth": 30,
    "pixel_depth": 30,
    "device_pixel_ratio": 2,
    "avail_left": 0,
    "avail_top": 25
  },
  "audio": {
    "sample_rate": 48000,
    "base_latency": 0.005333333333333333,
    "output_latency": 0.0125,
    "max_channel_count": 2
  },
  "media_devices": [
    { "kind": "audioinput",  "label": "Default - MacBook Air Microphone", "deviceId": "default", "groupId": "g1" },
    { "kind": "audioinput",  "label": "MacBook Air Microphone",           "deviceId": "a1",      "groupId": "g1" },
    { "kind": "audiooutput", "label": "Default - MacBook Air Speakers",    "deviceId": "default", "groupId": "g1" },
    { "kind": "audiooutput", "label": "MacBook Air Speakers",              "deviceId": "o1",      "groupId": "g1" },
    { "kind": "videoinput",  "label": "FaceTime HD Camera",                "deviceId": "v1",      "groupId": "g2" }
  ],
  "voices": [
    { "name": "Samantha", "lang": "en-US", "default": true,  "localService": true,  "voiceURI": "com.apple.voice.compact.en-US.Samantha" },
    { "name": "Alex",     "lang": "en-US", "default": false, "localService": true,  "voiceURI": "com.apple.voice.compact.en-US.Alex" },
    { "name": "Daniel",   "lang": "en-GB", "default": false, "localService": true,  "voiceURI": "com.apple.voice.compact.en-GB.Daniel" },
    { "name": "Karen",    "lang": "en-AU", "default": false, "localService": true,  "voiceURI": "com.apple.voice.compact.en-AU.Karen" },
    { "name": "Moira",    "lang": "en-IE", "default": false, "localService": true,  "voiceURI": "com.apple.voice.compact.en-IE.Moira" },
    { "name": "Tessa",    "lang": "en-ZA", "default": false, "localService": true,  "voiceURI": "com.apple.voice.compact.en-ZA.Tessa" }
  ],
  "fonts": {
    "installed": [
      "American Typewriter", "Andale Mono", "Apple Chancery", "Apple Color Emoji", "Apple SD Gothic Neo",
      "Apple Symbols", "AppleGothic", "AppleMyungjo", "Arial", "Arial Black", "Arial Hebrew",
      "Arial Narrow", "Arial Rounded MT Bold", "Avenir", "Avenir Next", "Avenir Next Condensed",
      "Baskerville", "Big Caslon", "Bodoni 72", "Bradley Hand", "Brush Script MT", "Chalkboard",
      "Chalkduster", "Charter", "Cochin", "Comic Sans MS", "Copperplate", "Courier", "Courier New",
      "Didot", "DIN Alternate", "DIN Condensed", "Futura", "Geneva", "Georgia", "Gill Sans",
      "Helvetica", "Helvetica Neue", "Herculanum", "Hoefler Text", "Impact", "Lucida Grande",
      "Marker Felt", "Menlo", "Monaco", "Noteworthy", "Optima", "Palatino", "Papyrus", "Phosphate",
      "Rockwell", "San Francisco", "Savoye LET", "SignPainter", "Skia", "Snell Roundhand",
      "Symbol", "Tahoma", "Times", "Times New Roman", "Trattatello", "Trebuchet MS", "Verdana", "Zapfino"
    ]
  },
  "webrtc": {
    "ip_handling_policy": "default_public_interface_only",
    "stun_servers": []
  },
  "canvas_noise": {
    "seed": "f0e1d2c3b4a596877685544332211009"
  },
  "tls": {
    "ciphers": "ALL:!aPSK:!ECDSA+SHA1:!3DES",
    "sigalgs": [
      "ecdsa_secp256r1_sha256",
      "rsa_pss_rsae_sha256",
      "rsa_pkcs1_sha256",
      "ecdsa_secp384r1_sha384",
      "rsa_pss_rsae_sha384",
      "rsa_pkcs1_sha384",
      "rsa_pss_rsae_sha512",
      "rsa_pkcs1_sha512"
    ],
    "curves": ["X25519", "P-256", "P-384"],
    "alpn": ["h2", "http/1.1"],
    "min_version": "tls1.2",
    "max_version": "tls1.3",
    "permute_extensions": true,
    "grease": true
  },
  "browser_state": {
    "history_length": 7,
    "download_count": 4,
    "extensions": [
      { "id": "cjpalhdlnbpafiamejdnhcphjbkeiagm", "name": "uBlock Origin", "version": "1.62.0" },
      { "id": "hdokiejnpimakedhajhdlcegeplioahd", "name": "LastPass: Free Password Manager", "version": "4.133.0" },
      { "id": "bgnkhhnnamicmpeenaelnjfhikgbkllg", "name": "AdGuard AdBlocker", "version": "4.4.39" },
      { "id": "eimadpbcbfnmbkopoojfekhnkhdbieeh", "name": "Dark Reader", "version": "4.9.96" }
    ]
  },
  "strip_automation_tells": true
}
