{
  "name": "linux_rx580_en-us",
  "version": 1,
  "identity": {
    "user_agent": "Mozilla/5.0 (X11; Linux x86_64) AppleWebKit/537.36 (KHTML, like Gecko) Chrome/154.0.0.0 Safari/537.36",
    "client_hints": {
      "brands": [
        { "brand": "Chromium", "version": "154" },
        { "brand": "Google Chrome", "version": "154" },
        { "brand": "Not A(Brand", "version": "99" }
      ],
      "platform": "Linux",
      "platform_version": "6.8.0",
      "architecture": "x86",
      "bitness": "64",
      "model": "",
      "mobile": false,
      "wow64": false
    },
    "navigator_platform": "Linux x86_64",
    "navigator_app_version": "5.0 (X11; Linux x86_64) AppleWebKit/537.36 (KHTML, like Gecko) Chrome/154.0.0.0 Safari/537.36",
    "navigator_vendor": "Google Inc.",
    "navigator_product": "Gecko",
    "navigator_product_sub": "20030107"
  },
  "locale": {
    "languages": ["en-US", "en"],
    "accept_language": "en-US,en;q=0.9",
    "timezone": "America/Denver",
    "currency": "USD"
  },
  "hardware": {
    "hardware_concurrency": 8,
    "device_memory_gb": 8,
    "max_touch_points": 0,
    "battery": {
      "charging": true,
      "level": 1.0,
      "charging_time_seconds": 0,
      "discharging_time_seconds": null
    }
  },
  "gpu": {
    "vendor": "Google Inc. (AMD)",
    "renderer": "ANGLE (AMD, AMD Radeon RX 580 (radeonsi, polaris10, LLVM 17.0.6, DRM 3.57, 6.8.0-generic), OpenGL ES 3.2)",
    "vendor_id": "0x1002",
    "device_id": "0x67df",
    "webgl_limits": {
      "MAX_TEXTURE_SIZE": "16384",
      "MAX_CUBE_MAP_TEXTURE_SIZE": "16384",
      "MAX_RENDERBUFFER_SIZE": "16384",
      "MAX_VIEWPORT_DIMS": "16384x16384",
      "MAX_SAMPLES": "8"
    },
    "webgl_excluded_extensions": [
      "WEBGL_compressed_texture_astc"
    ],
    "webgl_version": "WebGL 2.0 (OpenGL ES 3.0 Chromium)",
    "webgpu_adapter": {
      "vendor": "amd",
      "architecture": "polaris",
      "device": "rx-580"
    }
  },
  "screen": {
    "width": 1920,
    "height": 1080,
    "avail_width": 1920,
    "avail_height": 1080,
    "color_depth": 24,
    "pixel_depth": 24,
    "device_pixel_ratio": 1,
    "avail_left": 0,
    "avail_top": 0
  },
  "audio": {
    "sample_rate": 48000,
    "base_latency": 0.021333333333333333,
    "output_latency": 0.042666666666666665,
    "max_channel_count": 2
  },
  "media_devices": [
    { "kind": "audioinput",  "label": "Default - Monitor of Built-in Audio Analog Stereo", "deviceId": "default", "groupId": "g1" },
    { "kind": "audioinput",  "label": "Built-in Audio Analog Stereo",                       "deviceId": "a1",      "groupId": "g1" },
    { "kind": "audiooutput", "label": "Default - Built-in Audio Analog Stereo",              "deviceId": "default", "groupId": "g1" },
    { "kind": "audiooutput", "label": "Built-in Audio Analog Stereo",                        "deviceId": "o1",      "groupId": "g1" },
    { "kind": "videoinput",  "label": "USB Webcam",                                          "deviceId": "v1",      "groupId": "g2" }
  ],
  "voices": [
    { "name": "Google US English",         "lang": "en-US", "default": true,  "localService": false, "voiceURI": "Google US English" },
    { "name": "Google UK English Female",  "lang": "en-GB", "default": false, "localService": false, "voiceURI": "Google UK English Female" },
    { "name": "Google UK English Male",    "lang": "en-GB", "default": false, "localService": false, "voiceURI": "Google UK English Male" }
  ],
  "fonts": {
    "installed": [
      "Liberation Sans", "Liberation Serif", "Liberation Mono",
      "DejaVu Sans", "DejaVu Sans Mono", "DejaVu Serif",
      "Noto Sans", "Noto Serif", "Noto Sans Mono", "Noto Color Emoji",
      "Noto Sans CJK JP", "Noto Sans Arabic",
      "Cantarell", "Droid Sans", "Ubuntu", "Ubuntu Mono",
      "FreeSans", "FreeSerif", "FreeMono"
    ]
  },
  "webrtc": {
    "ip_handling_policy": "default_public_interface_only",
    "stun_servers": []
  },
  "canvas_noise": {
    "seed": "0819a2b3c4d5e6f70819a2b3c4d5e6f7"
  },
  "tls": {
    "ciphers": "ALL:!aPSK:!ECDSA+SHA1:!3DES",
    "sigalgs": [
      "ecdsa_secp256r1_sha256",
      "rsa_pss_rsae_sha256",
      "rsa_pkcs1_sha256",
      "ecdsa_secp384r1_sha384",
      "rsa_pss_rsae_sha384",
      "rsa_pkcs1_sha384",
      "rsa_pss_rsae_sha512",
      "rsa_pkcs1_sha512"
    ],
    "curves": ["X25519", "P-256", "P-384"],
    "alpn": ["h2", "http/1.1"],
    "min_version": "tls1.2",
    "max_version": "tls1.3",
    "permute_extensions": true,
    "grease": true
  },
  "browser_state": {
    "history_length": 6,
    "download_count": 2,
    "extensions": [
      { "id": "cjpalhdlnbpafiamejdnhcphjbkeiagm", "name": "uBlock Origin", "version": "1.62.0" },
      { "id": "eimadpbcbfnmbkopoojfekhnkhdbieeh", "name": "Dark Reader", "version": "4.9.96" },
      { "id": "nngceckbapebfimnlniiiahkandclblb", "name": "Bitwarden Password Manager", "version": "2025.1.0" }
    ]
  },
  "strip_automation_tells": false,
  "chrome_version": "154.0.8037.57"
}
